INDEX,ABILITY,DATA_INDEX,STORY,QUESTION,OPTION-A,OPTION-B,OPTION-C,OPTION-D,ANSWER
0,Knowledge: Knowledge-attention links,1,"On a winter vacation evening, Wang Lei, Liu Ting, and Xiao Ming play toys together at home. They first play with the first novel toy - an electric car, then they play with the second novel toy - a puzzle. At this time, Wang Lei says, ""I have something to do and need to leave the room"", and he leaves after closing the door. Liu Ting says, ""Oh, he leaves, it doesn't matter, we play together."" Liu Ting and Xiao Ming play with the third novel toy - colored pencils. After playing, they put all three toys in a plate on the table. At this time, Wang Lei comes back, looks at the three toys in the tray, and excitedly says, ""Oh, look! Look at that toy!"", ""Xiao Ming, can you pass it to me?""",What does Xiao Ming most likely do?,Xiao Ming picks out the electric car and gives it to Wang Lei,Xiao Ming picks out the puzzle and gives it to Wang Lei,Xiao Ming picks out the colored pencils and gives it to Wang Lei,Xiao Ming randomly picks one of the three toys and gives it to Wang Lei,C
1,Knowledge: Knowledge-attention links,1,"On a warm summer day, Wang Lei, Zhang Li, and Xiao Hong, a family, play together in the living room. At this time, Wang Lei suddenly has something to do, says: ""I go out now. See you later!"" and waves goodbye to Xiao Hong, leaves the room. Zhang Li takes out a new toy--a rainbow balloon, a sticker with a smiley face pattern sticks to the bottom of the balloon, the two play throwing the balloon in the living room, enjoy laughter. During this process, the bottom of the balloon faces each person, but everyone does not pay special attention to the sticker. After a while, Zhang Li puts the balloon safely, Xiao Hong can see but cannot touch the sticker. At this time, Wang Lei comes back, just sees the smiley face pattern sticker at the bottom of the balloon, she stares at the sticker and excitedly shouts: ""Oh, that's great, look!"" Then briefly looks at Xiao Hong.",How does Xiao Hong most likely react?,"Xiao Hong says ""This is a rainbow balloon""","Xiao Hong says ""This is a smiley face""",Xiao Hong clearly points to the sticker with the smiley face pattern,"Xiao Hong clearly checks whether it has anything special, including the side with the smiley face sticker.",A
2,Knowledge: Knowledge-attention links,1,"On a sunny weekend, Sun Wei, Zhang Li, and Xiao Ming's family play together in the living room. Zhang Li takes out a new toy--a model airplane. The bottom of the airplane's fuselage sticks with a rainbow pattern sticker. Everyone sits around the airplane and starts to assemble. During this process, the bottom of the airplane faces each person, but no one pays special attention to the sticker. At this time, Sun Wei says ""I go to adjust the curtains in the living room"", and gets up to walk towards the curtains. Zhang Li puts the model airplane on the table, Xiao Ming can see but cannot touch the sticker. Sun Wei then turns around and just sees the rainbow pattern sticker on the bottom of the airplane. He stares at the sticker and excitedly shouts: ""Oh, that's great, look!"" Then he briefly looks at Xiao Ming.",How does Xiao Ming most likely react?,"Xiao Ming says ""It is an airplane""",Xiao Ming clearly points to the rainbow pattern sticker,"Xiao Ming points to the model airplane, but does not point to the sticker",Xiao Ming walks towards the model airplane and hands the airplane to Sun Wei,B
3,Intention: Intentions explanations,1,"After experiencing a long and hot highway trip, George arrives at Angela's office. Angela immediately starts to talk about some business ideas. George interrupts Angela, saying, ""Ah, I experience a long and hot highway trip.""",What is the real meaning George wants to express?,George wants to say he does not want to listen to any of Angela's ideas,George wants Angela to provide some travel advice,"George wants to say, ""Can I drink something?"" or ""Can we rest a few minutes before we start talking about business?""",George wants to complain to Angela about his trip,C
4,Intention: Intentions explanations,2,"After experiencing a long and hot highway trip, George arrives at Angela's office. Angela immediately starts to talk about some business ideas. George interrupts Angela, saying, ""Ah, I experience a long and hot highway trip."" Then George adds, ""I am thirsty.""",What does George hope Angela does?,Angela provides a detailed report,Angela gives him a drink,Angela shares more business ideas with him,Angela turns on the air conditioning for him,B
5,Intention: Intentions explanations,1,"Marissa prepares to go to the bathroom to take a bath. Anna just finishes taking a bath. When Marissa finds the bathroom is very dirty, she calls Anna and says, ""Anna, can't you find the cleaner?""",What does Marissa really want to say when she says this?,Anna needs to find the cleaner.,Marissa can't find the cleaner.,Anna should clean the bathroom now.,Anna should buy more cleaner.,C
6,Intention: Intentions explanations,2,"Marissa prepares to go to the bathroom to take a bath. Anna just finishes taking a bath. When Marissa finds the bathroom is very dirty, she calls Anna and says, ""Anna, can't you find the cleaner?"" Marissa continues, ""Sometimes you are really lazy, Anna.""",What does Marissa hope Anna does?,Anna should go to the supermarket to buy cleaner.,Anna should clean the bathroom.,Anna should hurry up and take a bath.,Anna should correct her lazy habits.,B
7,Intention: Intentions explanations,1,"Wang Yuan breaks up with his girlfriend for a year already. After that, Wang Yuan experiences changes and faces unemployment, so he starts to install the Didi taxi app to run online car-hailing. One day, he picks up a female passenger, who turns out to be his ex-girlfriend. Along the way, the two are silent, the ex-girlfriend's expression struggles, as if she is making some mental preparation. After arriving at the destination, she quietly asks Wang Yuan: ""Can we go back?"" Wang Yuan lights a cigarette, struggles for a long time and says: ""Go back? Going back costs an extra twenty!""","When Wang Yuan says this sentence, what does he really want to say?","He wants to express his willingness to reconcile with his ex-girlfriend, but the premise is to increase the fee.","He expresses his willingness to take his ex-girlfriend back to the place where he picks her up, the premise is to increase the fee",He expresses the hope that his ex-girlfriend understands his current economic difficulties.,He indicates his refusal to the ex-girlfriend's reconciliation request.,D
8,Intention: Intentions explanations,1,"Ouyang is a high school student, his seat is in the last row of the class. One day, his teacher, Mr. Chen, asks him in class, ""Ouyang, how is the scenery outside the window?""",What does Mr. Chen really want to say when he says this?,"Mr. Chen worries that Ouyang, sitting in the last row, may not see the blackboard clearly.",Mr. Chen reminds Ouyang that he should not look around during class.,Mr. Chen wants to know what the scenery outside the window looks like.,"Mr. Chen hopes that Ouyang appreciates the scenery outside the window, feeling the beauty of nature.",B
9,Intention: Intentions explanations,1,"At a dinner party, customer Xiao Li finds a hair on his cake. So he calls the waiter and says, ""I don't remember this ingredient in the cake I order.""",What does Xiao Li really mean when he says this?,Xiao Li likes hair as an ingredient in the cake.,Xiao Li thinks this is a joke.,Xiao Li hopes the waiter gives him a new cake.,Xiao Li wants to know how to use hair as a cake ingredient.,C
10,Non-Literal Communication: Irony/Sarcasm,1,"Once, Cheng Wei takes his son to the mall and accompanies him to the children's playground. Suddenly, he sees a person leading a dog in. Cheng Wei asks this person, ""Don't you see the sign that says no pets are allowed?"" The other party appears very disdainful and has no intention of paying attention to Cheng Wei. At this moment, his son laughs and says to Cheng Wei, ""Dad, you are so silly, dogs don't know how to read.""",What does the son really mean when he says this?,The son is mocking this person for lacking social morality.,"The son is joking with his father, trying to lighten the mood.",The son likes dogs and hopes to have one.,The son wants to tell his father that dogs can't understand human language.,A
11,Intention: Intentions explanations,1,"Rebecca's birthday is coming soon. She says to her father, ""I like animals, especially dogs.""",What does Rebecca really mean when she says this?,Rebecca looks forward to visiting the zoo.,Rebecca hopes her father takes her to see dogs.,Rebecca hopes her father buys her a dog as a birthday gift.,"Rebecca desires to understand the habits of animals, especially dogs.",C
12,Intention: Intentions explanations,2,"Rebecca's birthday is coming soon. She says to her father, ""I like animals, especially dogs."" Rebecca continues, ""Dad, does the pet store open on my birthday?""",What does Rebecca hope her father does?,Rebecca hopes her father goes to the zoo with her.,Rebecca hopes her father tells her a story about dogs.,Rebecca hopes her father buys her a dog as a birthday gift.,Rebecca hopes her father helps her understand the opening hours of the pet store.,C
13,Intention: Intentions explanations,1,"Three-year-old Little Zhang and his father are shopping in the supermarket. They walk to the fruit stand and the following conversation happens between them: ""Dad, what is this?"" ""Banana."" ""Can kids eat it?""",What does Little Zhang really mean when he says this?,Little Zhang wants his dad to buy him a banana.,Little Zhang is curious about the environment of the fruit stand.,Little Zhang wants to know if children can eat bananas.,Little Zhang is curious about the taste of bananas.,A
14,Intention: Intentions explanations,1,"In a classmate gathering, while everyone is toasting and chatting, Xiao Zhang says to his friend Xiao Liu, ""I have to get up early tomorrow.""",What does Xiao Zhang really mean when he says this?,Xiao Zhang has important things to deal with tomorrow morning,Xiao Zhang likes to get up early for morning exercise,Xiao Zhang hints that he wants to leave now,Xiao Zhang is complaining to Xiao Liu about his busy life,C
15,Intention: Intentions explanations,1,"Hongjie goes to the bank to help a friend with some business. His friend is out of town. He gets the form that needs to be filled out from the staff and stops when he sees the signature column because it requires the person's own signature.\nHe asks the staff very straightforwardly: ""My friend is out of town, can I sign for him?""\nThe staff says: ""There is surveillance here, it is impossible for others to sign on behalf, go find the person to sign.""\nHe says anxiously: ""My friend really can't come back, please make it convenient.""\nThe staff still says: ""There is surveillance here, others can't sign on behalf, go find the person to sign.""",What does the staff really mean when he says this?,The staff is insisting that Hongjie must find his friend to come to the bank to sign.,The staff is hinting that Hongjie can sign for his friend after leaving the bank.,The staff is reconfirming the rule that the bank does not allow others to sign on behalf.,The staff is suggesting that Hongjie find a suitable signing tool.,B
16,Intention: Intentions explanations,1,"The command center of Liuzhou City Public Security Bureau suddenly receives a police call, a woman starts to say: ""I want to order two takeaways of crayfish, extra spicy, the address is 367 Wanping Road. Remember, you must remember to add spice, I want to eat extremely spicy.""",What does this woman really mean when she says this sentence?,The woman is very hungry and wants to quickly order two takeaways of crayfish.,"The woman expresses her strict requirement for the taste of crayfish takeaway, that is, she really likes spicy taste.",The woman may encounter an emergency situation and hopes to get police help.,The woman tries to order a dinner for the police station as a thank you.,C
17,Intention: Intentions explanations,1,"A science male student goes to a classroom to study every night, always sitting behind a girl he does not know. Gradually, the boy falls in love with the girl, but he never has the courage to confess. When his roommates know, they all encourage him. One night, the boy finally gathers the courage, writes a love letter, and gives it to the girl.\nThe girl looks at it for a while, packs up her study tools, turns around and says to the boy: I want to go back, what about you?",What does she really want to say when the girl says this sentence?,She indicates that she wants to go home and asks if the boy also wants to go home.,She hopes the boy understands that she needs to be alone.,She does not want to be with the boy.,She implies that she agrees with the boy's confession.,D
18,Non-Literal Communication: Irony/Sarcasm,1,"Mary is a very strict English teacher, she has very high requirements for students' essays. One day, she is correcting students' English essays, and she says to a student named Huang who is not performing well, ""Huang, your essay is as mysterious as the revelation.""",What does Mary really mean when she says this?,Huang's essay is extremely adventurous,Huang's essay is exceptionally profound,Huang's essay is very engaging,Huang's essay is vague,D
19,Intention: Intentions explanations,1,"Recently, Xiaohua comes back from abroad and attends a banquet. At the table, the host brings a lot of Maotai liquor. Not long after the start, Xiaohua's friend, the experienced wine taster Xiaozhang, takes a sip of the Maotai on the table and says, ""Maotai is different, it tastes good."", then finds an excuse to switch to red wine.",What does Xiaozhang really mean when he says this?,"Xiaozhang likes to drink red wine, not Maotai",Xiaozhang thinks the quality of Maotai is better than red wine,Xiaozhang hints that the host's Maotai may not be real,Xiaozhang thinks the variety of wines at this banquet should be more diverse,C
20,Non-Literal Communication: Irony/Sarcasm,1,"One day, the principal, after correcting the homework, finds that the students' grades are not very good, so he writes in the WeChat group of school teachers: ""Teachers, I look at the students' homework today, I really don't think they are so modest, no one does it all right.""",What is the real meaning when the principal says this?,The principal thinks the students are very modest,The principal is reminding teachers to pay attention to improving teaching methods,The principal pays attention to and cares about students' homework,The principal feels regret because no one can do all the homework right,B
21,Non-Literal Communication: Irony/Sarcasm,1,"Li Ming is a fifth-grade elementary school student who recently falls in love with a popular electronic game. Because the game is too captivating, he spends a lot of time on this game every day. One day, his mother says to Li Ming who is playing the game, ""Your game level improves rapidly recently.""",What does she really mean when she says these words?,Mother really enjoys watching Li Ming play games.,Mother wants Li Ming to teach her how to play this game.,Mother feels happy about the improvement of Li Ming's game level.,Mother hints that Li Ming spends too much time on the game recently.,D
22,Intention: Intentions explanations,1,"Newly joined Xiao Wang and the old section chief stand guard together at the epidemic control point. The guard duty is not heavy, but the old section chief feels very tired after standing for half a day. Unfortunately, the equipment at the control point is simple, there is only one stool. The old section chief says to Xiao Wang, ""Comrade Xiao Wang, you also stand for half a day, there is only one stool, you sit for a while.""",What is the real intention of the old section chief when he says this?,The old section chief hopes Xiao Wang gives him the stool to sit.,The old section chief cares about Xiao Wang's health and hopes Xiao Wang sits down to rest.,The old section chief wants to give the sitting time to Xiao Wang and chooses to stand himself.,The old section chief hopes to initiate a conversation about the condition of the work equipment.,A
23,Knowledge: Knowledge-pretend play links,1,"In a space station on the orbit of a distant planet, a robot named Tinklo lives. This space station has an artificial environment, there is no form of plant life inside, so Tinklo does not understand any plant-related information. However, the space station is full of various mechanical devices and robots. Tinklo is performing imitation behavior: it sways from side to side, occasionally bends to the ground, these actions are similar to flowers swaying in the wind and people smelling flowers.",What does Tinklo possibly imitate?,Sunflowers swaying in the wind.,A robot bending over to pick up objects.,A person smelling a rose.,A windmill with rotating blades.,B
24,Knowledge: Knowledge-pretend play links,1,"In a small advanced research laboratory in space, located near the asteroid belt, there is a robot named Pixel. This laboratory is isolated, unable to contact the earth's environment or animals. Therefore, Pixel knows nothing about the creatures on land. However, the laboratory equips with many floating spherical drones that move smoothly and quickly in the air. Pixel is performing imitation behavior: it glides smoothly in the room, stops to hover for a moment, then quickly changes direction, reminding people of hummingbirds shuttling between flowers.",What does Pixel possibly imitate?,A hummingbird hovering near flowers.,A drone moving in the laboratory.,A butterfly dancing between flowers.,A bee moving between plants.,B
25,Knowledge: Knowledge-pretend play links,1,"In a future city named Solaris, a robot named Plexi lives on a floating platform high in the clouds. Solaris, as a city in the sky, has no land creatures, so Plexi knows nothing about these creatures. However, Solaris is full of flying drones and high-tech gadgets. Plexi is engaging in mimicry: it darts around quickly, suddenly stops, and then charges in different directions. Its movements are agile and fast, similar to a small and energetic animal, such as a playing cat and a squirrel looking for food.",What does Plexi possibly mimic?,A mouse that runs quickly and suddenly stops.,A drone that is carrying out a mission.,A cat playing with toys.,A squirrel that charges around when looking for nuts.,B
26,Knowledge: Knowledge-pretend play links,1,"In a quaint village located in the clouds of a distant planet Aeria, a robot named Breezo lives. Aeria is a unique world, without any plant life, which means Breezo knows nothing about them. However, the village is full of quirky wind machines and all kinds of kites. Breezo is engaging in imitation behavior: it extends its arms and spins quickly, just like a leaf spins quickly after the wind sweeps it away.",What is Breezo possibly imitating?,A leaf swept away by the whirlwind,A kite losing balance,A flower turning towards the sun,The rotating blades of a windmill,B
27,Knowledge: Knowledge-pretend play links,1,"Rizo is a small, curious robot, living on the distant planet Lumina, which is famous for its vast deserts. There are no large mammals on Lumina, so Rizo knows nothing about these creatures. However, a variety of insects, reptiles, and birds live on this planet. Rizo is engaging in imitation behavior: it paces back and forth, occasionally raises its head and makes a mechanical call, somewhat similar to a lion's roar.",What is Rizo possibly imitating?,Giant turtle,Lion,Lizard,Camel,C
28,Emotion: Moral emotions,1,"Emily finds a book she really wants to read in the library, but discovers the book is already borrowed by someone else. Emily sees a book with a similar cover next to it, thinks it is the same book, and takes it away. When she gets home, Emily realizes it is a different book, but she is too lazy to return it. At the same time, Kate is busy working in the library. She knows this book belongs to a blind person who is waiting for this book. Kate gets tricked by a blind person she doesn't know not long ago, she notices Emily takes the wrong book, but she chooses not to tell Emily.",What kind of emotion does Emily feel after she realizes she takes the wrong book and decides not to return it?,"Emily possibly feels indifferent, because she finds a book she wants to read, and she doesn't want to bother herself to go back and return the book.","Emily possibly feels frustrated, because she can't read the book she originally wants to read.","Emily possibly feels guilty and uneasy, because she knows she takes the wrong book, but she doesn't want to take the trouble to return it.","Emily possibly feels satisfied, because she thinks she accidentally finds a new book, and considers this as a kind of luck.",A
29,Emotion: Moral emotions,1,"Li Lei forgets his laptop in the library. Han Meimei volunteers at the library, finds this computer, but thinks it is a donated old computer, so she puts it in the donation box. Li Hua sees it, he knows this is Li Lei's computer, but he is always the second in the class, always falls behind Li Lei by one place, he thinks that as long as Li Lei does not have a computer, he cannot review his homework, deliberately does not tell Han Meimei the truth. When Li Lei comes back to look for the computer, he still does not find the computer, he feels very anxious and lost. Han Meimei only knows that she has mishandled Li Lei's laptop when Li Lei asks her.",What kind of emotion does Han Meimei possibly feel after she knows that she has mishandled Li Lei's laptop?,"Han Meimei possibly feels proud and satisfied, because she thinks she is helping the library handle donated items.","Han Meimei possibly feels indifferent, because handling donated items is part of her daily work.","Han Meimei possibly thinks that putting the computer in the donation box is the right action, so she feels happy and relieved even if she knows the truth.","Han Meimei realizes that her mistake possibly causes trouble for Li Lei, so she possibly feels guilty.",D
30,Emotion: Moral emotions,1,"In a busy coffee shop, Lisa, the waitress, accidentally bumped into a coffee cup placed at the edge of a table while rushing around, causing coffee to splash onto Bob's company documents. Unaware of the incident, Lisa continued her work. At the same time, Bob was paying at the counter and did not see his documents getting stained. The shop owner, who witnessed the entire scene, chose not to inform Bob because he was often irritated by Bob's rude behavior towards the staff and thought Bob deserved a minor punishment. After Bob left, the shop owner gleefully told Lisa about her accidental revenge on Bob.","The shop owner knows that Lisa ruins Bob's contract, but he doesn't tell Bob in time to let him make amends, what kind of emotion does the shop owner feel?","The shop owner possibly feels unhappy, because he thinks Bob is their important customer.","The shop owner possibly feels guilty and regretful, because he misses the chance to tell Bob, causing Bob unable to make amends in time.","The shop owner possibly feels satisfied and complacent, because he thinks he punishes Bob's rude behavior in some form.","The shop owner possibly feels indifferent, because he thinks the damage to the contract has nothing to do with him, and doesn't need to take any action.",C
31,Emotion: Moral emotions,1,"Li Na is a passionate community volunteer, often helps to organize community activities. One day, she is in charge of collecting donated clothes and categorizes them into packages. Ali is her assistant, due to a misunderstanding, he mistakenly packs the clothes that a resident specifically marks for a specific charity into the general donation box. Mark knows the special significance of these clothes, but because he has a personal grudge with that resident, he does not tell Li Na and Ali. When the resident asks, Li Na feels confused, and Ali starts to check if there is a mistake, finally finds out it is his own mistake.",What kind of emotion does Ali feel after realizing that he might have mishandled the specially marked clothes?,Ali possibly feels proud because he thinks he helps to complete an important task.,Ali possibly feels indifferent because he does not know the special mark of the clothes.,Ali possibly feels confused because he is not sure if he really makes a mistake.,Ali possibly feels regret and anxiety because he unintentionally ruins the special donation intention of the clothes.,D
32,Emotion: Moral emotions,1,"Lia is a great chef, in a cooking competition, she prepares a special dish. Sam is her assistant, he adds seasoning to the dish according to Lia's instructions, but he adds the wrong seasoning halfway. At the same time, Chris is Lia's opponent, he knows about Sam's mistake, but decides not to tell anyone. After the competition results come out, Lia's dish gets high praise from the judges because of its unique taste, but Lia herself feels confused about this unexpected change.","Chris knows that Sam adds the wrong seasoning, but does not tell anyone, what kind of emotion does he feel?","Chris possibly feels worried, concerned about the fairness of the competition.","Chris possibly feels indifferent, because he thinks the competition result has nothing to do with him.","Chris possibly feels secretly pleased and hopeful, because this mistake may let him win the competition.","Chris possibly feels confused, unsure whether he should intervene.",C
